Timestamp,What is the gift's name?,Describe the gift,What does the gift cost?,Who is the manufacturer?,What is the link where people can buy it? (This should be the URL of this item on the seller's site.),Do we have the picture yet?,What type of gift are you looking for?,Picture file name,Who is the gift for?,What kind of person are they?,Price range
11/13/2012 12:02:21,Bed jacket,"Made by one of the few remaining underwear factories in the UK and using English lace, his beautiful silk bedjacket is too good to wear only at night
",89,Ayten Gasson,http://www.aytengasson.com/collections/silk-nightwear/products/harma-lace-bed-jacket,Yes,"Fashion, Luxury gifts",aytengassen.jpg,Woman,"Traditionalist, Ethical",£50-100
11/13/2012 12:04:53,Leather satchel,An old-school design from a lovely company specialising in hand-built bikes and accessories. It also has a smaller satchel – and do check out its stunning bikes,120,Beg Bicycles,http://www.begbicycles.com/ride/old-school-satchel,Yes,"Fashion, Accessories, Luxury gifts",begbikesbag.jpg,"Man, Woman","Outdoorsy type, Design lover, Traditionalist",+ £100
11/13/2012 12:10:35,Knitted dinosaur,A friendly dinosaur and some doughnut rattles from Best Year's crochet range – all of which are made in fair-trade conditions,12,Best Years,http://www.littlegifthouse.co.uk/ourshop/prod_2109532-Knitted-Green-TRex-Dinosaur.html,Yes,Toys,bestyears.jpg,"Child, Baby or toddler",Ethical,£10-25
11/13/2012 12:13:34,A-Z jigsaw,Little hands will love fitting the letters into the right slots – slightly older ones will enjoy methodically assembling the alphabet,13.99,Bigjigs Toys,http://shop.bigjigstoys.co.uk/products/productdetail/Chunky+Alphabet+Puzzle/part_number=BB055/12465.0.4.3.1019328.0.0.0.0?pp=20&,Yes,Toys,bigjigsatoz.jpg,"Child, Baby or toddler",Traditionalist,£10-25
11/13/2012 12:16:16,Beauty treat,"A miniature pampering gift that can also be hung on the tree. Contains a bath and shower oil that promises to enhance feelings of sociability – and who doesn't need that come Christmas Day evening? 
",12,Aromatherapy Associates,http://www.feelunique.com/p/Aromatherapy-Associates-Little-Treat?q=christmas,Yes,"Homes/ decor, Decorations, Beauty",aromatherapyassociates.jpg,"Woman, Teenager",Traditionalist,£10-25
11/13/2012 12:25:41,Beauty subscription,"If you're not sure what beauty products to buy as gifts, how about a subscription that selects the best products for individual needs? The recipient will get a beautifully packaged box every month full of well-known brands, as well as tips and content on the website
",From 20,Birchbox,http://joliebox.co.uk/,Yes,Beauty,birchbox.jpg,"Woman, Teenager",Traditionalist,£25-50
11/13/2012 12:29:12,Gift subscription,"A unique and beautifully designed magazine for kids, totally unlike anything else on the market. The illustrations are beautiful enough to please the most finickity parent, and fun enough to engage children. The recommended reading age is around five to 10 but this can be interpreted pretty loosely. A gift subscription of £26 is for four issues, or you can also sign up for eight",26,Anorak Magazines,http://shop.anorakmagazine.com/product/anorak-subscription-vouchers,Yes,"Stocking fillers, Toys, Homes/ decor, Stationery",Anoraksubscription.jpg,Child,"Design lover, Culture vulture",£25-50
11/13/2012 12:31:27,Child's rucksack,"A striking graphic design perfect for little animal lovers, this rucksack is screen printed on organic cotton. A monkey, owl or squirrel is also available",29.5,Mibo,http://www.mibo.co.uk/collections/rucksacks,Yes,"Kids clothes, Toys, Accessories",Backpack.jpg,"Child, Baby or toddler",Outdoorsy type,£25-50
11/13/2012 12:34:18,Knit your own dog,"All the instructions you need to knit your own dog – from spaniel to old English sheepdog. Even if you don't knit, the photos of the knitted dogs are adorable. And if you are reeling in horror, don't worry, there's a Knit your Own Cat version too",12.99,Anova Books,http://store.anovabooks.com/,Yes,"Toys, Craft, Decorations",bestinshow.jpg,"Man, Woman, Teenager, Child, Pet",Traditionalist,£10-25
11/13/2012 12:36:51,Knitting kit,"This kit contains everything you need to know to start casting off, all wrapped up in a sweet suitcase. As well as instructions you also get four balls of wool, bamboo needles, two needle kits with plastic and metal sewing needles and pins, felt squares and buttons. Lovely for junior crafters too",20,Buttonbag,http://www.buttonbag.co.uk/details.php?id=105,Yes,"Homes/ decor, Craft",ButtonbagKnitting.jpg,"Teenager, Child",Traditionalist,£10-25
11/13/2012 12:44:49,Stationery advent calendar,"A truly luxury gift for a stationery fetishist – they had better not expect anything on Christmas Day after this advent gift. Among other treats are traditional Japanese scissors, a Fürst mechanical pencil and a Leuchturm tiny address book",110,Nonesuchthings,http://nonesuchthings.com/,Yes,"Homes/ decor, Stationery, Decorations, Luxury gifts",AdventHighRes.jpg,"Man, Woman",Design lover,+ £100
11/13/2012 12:47:44,Tree decoration,Put a pooch in your tree with this sweet felt decoration (also available is a very fetching Christmas pud),4.5,Cath Kidston,https://www.cathkidston.co.uk/p-18808-cath-kidston-stanley-felt-decoration.aspx?referrer=category,Yes,"Homes/ decor, Decorations",CathKidston.jpg,"Child, Baby or toddler, Pet",Traditionalist,Under £10
11/13/2012 12:50:25,Thermos flask,"Everyone needs a nice vacuum flask for picnics, road trips, or hot chocolate in the playground. The cap doubles up as a drinking cup and the design is sweet enough for kids but also works for adults. Holds 350ml, and is BPA free
 ",22.35,Blafre ,http://www.iglookids.co.uk/igloo-clothing-products/brand-blafre/blafre-hedgehog-thermal-flask/5409/,Yes,"Homes/ decor, Gardens, Food gifts",BlafreHedgehog.jpg,"Teenager, Child, Baby or toddler, Couples","Outdoorsy type, Traditionalist, Ethical",£10-25
11/13/2012 12:53:14,Carving set,Serious foodies will argue for hours on the relative merits of knives. These Japanese steel ones were selected by the founder of London's Divertimenti cookshop – but browse the rest of the site for more sharp suggestions,89.5,Naifu,http://www.chefsknifestore.co.uk/products/d67-2-pc-carving-set,Yes,"Homes/ decor, Food gifts, Luxury gifts",CarvingSet.jpg,"Man, Woman","Design lover, Traditionalist",£50-100
11/13/2012 12:55:50,Illustrated cleaning cloth,"Yes, it's a cleaning cloth. Bear with us. This is a truly beautifully illustrated cleaning cloth – there are numerous different designs – perfect for design lovers and gadget hoarders. A very clever idea and both a stylish and genuinely useful gift",4.99,Everything is Illustrated,http://everythingisillustrated.net/,Yes,"Stocking fillers, Homes/ decor, Stationery, Gadgets",everythingisillustrated.jpg,"Man, Woman, Teenager",Design lover,Under £10
11/13/2012 12:57:56,Laptop sleeve,What to get the gadget lover who has everything? A luxury leather and tweed laptop sleeve in which to home their beloved laptop,149.95,Incase,http://www.johnlewis.com/231625104/Product.aspx,Yes,"Accessories, Luxury gifts, Gadgets",Incasesleeve.jpg,"Man, Woman","Design lover, Traditionalist",+ £100
11/13/2012 13:20:05,Silver acorn pendant,"Sterling silver pendant with a 16"" chain. Seek and Adore is packed with gorgeous gifts from British designer-makers, so do have a browse",60,Antonia Ross ,http://www.seekandadore.com/c/0/p/silver-acorn-pendant/1378.aspx,Yes,"Fashion, Jewellery, Accessories",AntoniaRoss.jpg,"Woman, Teenager","Design lover, Traditionalist, Ethical",£50-100
11/13/2012 13:22:06,Dreaming cat necklace,"Black and white plastic (with waterproof varnish) and silver-plated chain, packaged in a hand-stamped giftbox

",18.5,Tilly Bloom,http://www.culturelabel.com/the-cat-that-dreamt-of-the-moon-necklace.html,Yes,"Fashion, Jewellery, Accessories",CatMoonTillyBloom.jpg,"Woman, Teenager",Design lover,£10-25
11/13/2012 13:25:20,Stationery set,"Beautifully handmade in the UK, this wooden box contains 10 sheets of letterpress paper, 10 plain sheets, 5 correspondence cards and 15 envelopes. So that's the thank-you cards sorted, too. 

",28,Chase and Wonder,http://shop.chaseandwonder.com/product/ride-above-it-writing-set,Yes,"Homes/ decor, Stationery",chaseandwonderwritingset.jpg,"Man, Woman, Teenager","Design lover, Traditionalist, Ethical",£25-50
11/13/2012 13:27:06,Notecard sets,"The V&A shop cannot be beaten for stylish, reasonably priced gifts based on classic designs. Set of 12 notecards with floral designs in a neat box.",12.5,V&A,http://www.vandashop.com/V-A-Flocked-Floral-Notecards/dp/B00937ULB4,Yes,"Homes/ decor, Stationery",flockednotecards.jpg,"Man, Woman, Teenager, Couples","Design lover, Culture vulture, Traditionalist",£10-25
11/15/2012 10:34:23,Mum and baby gift set,"Got an expectant or new mum to shop for? This nightgown is made from soft, comfortable fabric and the sweet matching babygrow is in a unisex design",55,Amoralia,http://www.amoralia.com/shop/nightwear/lace-trim-nightdress-set/cat5/prod255/,Yes,"Kids clothes, Fashion",amoralia.jpg,"Woman, Baby or toddler",Traditionalist,£50-100
11/15/2012 10:59:10,Cashmere cardigan,"Because babies deserve a bit of stylish luxury too. Unlike most cashmere, this supersoft cardigan can be machine washed. Available in sizes up to five years, there's also a matching blanket",48.5,Bonnie Baby,http://www.bonniebaby.co.uk/shop-girls/baby-girs-12-24-months/autumn-winter-2012-panda-cotton-cashmere-jacket.html,Yes,"Kids clothes, Luxury gifts",bonniebaby.jpg,"Child, Baby or toddler",Traditionalist,£25-50
11/15/2012 11:11:17,Child's apron,"A sweet apron perfect for junior chefs, bakers or enthusiastic painters",5.99,Dear Zoo,http://www.dearzooshop.co.uk/dear-zoo-apron.html,Yes,"Stocking fillers, Kids clothes, Food gifts",DearZooapron.jpg,"Child, Baby or toddler",,Under £10
11/15/2012 11:13:44,Skittle set,"Dear Zoo is a perennial favourite with young children, and this soft skittle set brings the characters to life. Comes in a little storage bag for handy transportation indoors and out",28.99,Dear Zoo,http://www.dearzooshop.co.uk/12298-jpg.html,Yes,"Toys, Gardens",DearZooskittles.jpg,"Child, Baby or toddler",,£25-50
11/15/2012 11:19:31,Dinner set,"Bring the scenery to the dinner table with this charming dinner set. Colourful enough for kids but also beautifully designed, so will please picky parents too",30,V&A,http://www.vandashop.com/V-A-Shop-Landscape-Dinner/dp/B009LQDP0G?field_availability=-1&field_browse=2105199031&field_product_site_launch_date_utc=-1y&id=V+A+Shop+Landscape+Dinner&ie=UTF8&refinementHistory=subjectbin%2Cgeneric_text_9-bin%2Cgeneric_text_1-bin%2Cprice&searchNodeID=2105199031&searchPage=3&searchRank=salesrank&searchSize=12,Yes,"Toys, Homes/ decor, Food gifts",dinnerset.jpg,"Child, Baby or toddler",Design lover,£25-50
11/15/2012 11:24:05,Mobile,"A charming and unusual luminous mobile featuring nocturnal woodland creatures, made from colourful polypropylene. Comes part-assembled with instructions for the remainder of the construction. Perfect for a nursery or a young child's bedroom
",19.99,Djeco,http://www.cotswoldtrading.com/Products/Djeco-An-Unusual-Night-Mobile.aspx,Yes,"Toys, Homes/ decor, Decorations",DjecoMobile.jpg,"Child, Baby or toddler","Design lover, Traditionalist",£10-25
11/15/2012 11:27:22,Dog on wheels,"The pull-along toy is a always a winner with young walkers, and this dog is particularly adorable. Made from fluffy strokable fleece, you'll want to take him for walkies too",53,Trousselier,http://www.cottontailsbaby.co.uk/product/Trousselier_pull_along_dog,Yes,Toys,dogonwheels.jpg,"Child, Baby or toddler",Traditionalist,£50-100
11/15/2012 11:31:02,Tiger cushion,"While they are too young to understand the concept of Christmas, get something nice for a baby's room instead. This tiger cushion will see them through a good many years before they claim to be too grown up for it",38,Fern Living,http://www.homeandkids.co.uk/Homeware/kids-decor/ferm-living-kids-decor/ferm-living-tiger-cushion,Yes,"Toys, Homes/ decor",fernliving.jpg,"Child, Baby or toddler",,£25-50
11/15/2012 11:34:57,Soft bear,"Softer than a sheep that has been through the tumble dryer on super-soft cycle and then back-combed through a cloud of cottonwool, this adorable range of bears are flat so they can be snuggled up to and used as mini pillows by adults and children alike. Buy one as a gift, but we warn you: you'll want to keep it",From 29,Flatout Bear,http://www.peggedonline.co.uk/shop.cfm,Yes,"Toys, Luxury gifts",flatoutbear.jpg,"Child, Baby or toddler",Traditionalist,£25-50
11/15/2012 11:40:02,Gruffalo mug set,"Oh dear! Oh no! It's a Gruffalo … If this means nothing to you, don't worry, it will for anyone about half your height. Perfect for a warming hot chocolate and biscuit treat on a cold winter's day",8.99,Wild & Wolf,http://www.lakeland.co.uk/43516/Gruffalos-Child-Mug-and-Spoon-Set,Yes,"Stocking fillers, Homes/ decor, Food gifts",gruffalomug.jpg,Child,,Under £10
11/15/2012 11:44:04,Hobby horse,Get traditional with a hobby horse – this simple and very reasonably-priced design comes in either floral print or chunky brown cord for a plainer equine look,18,GLTC,http://www.gltc.co.uk/cord-hobby-horse//gltc/fcp-product/10000002331,Yes,Toys,hobbyhorse.jpg,"Child, Baby or toddler",Traditionalist,£10-25
11/15/2012 11:46:14,World-map print,"A wonderful unframed print featuring animals, from designer Katie Viggers – this is a charming and quirky take on a world map",18,Eightbear,http://www.eightbear.co.uk/Site/print_Animal_Map.html,Yes,"Homes/ decor, Decorations",katieviggersprint.jpg,Child,Design lover,£10-25
11/15/2012 11:51:59,Bear-family print,"Perfect for ursine lovers of all ages, this print features a quirky spin on the different members of the bear family",14,Eightbear,http://www.eightbear.bigcartel.com/product/the-bear-family-print,Yes,"Homes/ decor, Decorations",katieviggersprint2.jpg,"Child, Baby or toddler",Design lover,£10-25
11/15/2012 11:55:24,Winter animals,Beautiful designs hand-stitched using organic cotton and eco-fi felt (made from waste plastic bottles); these cushions are made with love and to last a lifetime,From 28,Lettie Belle,http://www.lettiebelle.com/christmas-collection-2012/372007_arctic-fox-cushion-small.html,Yes,"Toys, Homes/ decor",lettiebelle.jpg,"Child, Baby or toddler","Design lover, Traditionalist, Ethical",£25-50
11/15/2012 12:00:13,Velour hat,"A soft, organic, velour beanie hat featuring thunderbolts and lightning, very very frightening. Except not frightening at all. Just cute. Comes in sizes up to five years, though sizing is approximate (based on head circumference) so check the charts.

",15,DUNS Sweden,http://www.loveitloveitloveit.co.uk/duns-sweden-turquoise-cloud-hat/,Yes,"Kids clothes, Accessories",loveithat.jpg,"Child, Baby or toddler",Ethical,£10-25
11/15/2012 12:05:43,Landscape scene rompers,"Smafolk makes awesome prints for young kids – this truly bucolic romper is for babies to, well, romp in. The fabric is Oeko-tex certified free from harmful substances, too. So basically it's an organic farm",18,Smafolk,http://www.loveitloveitloveit.co.uk/smafolk-landscape-romper/,Yes,Kids clothes,loveitromper.jpg,Baby or toddler,"Design lover, Ethical",£10-25
11/15/2012 14:42:02,Shape sorter,"Sweet, robust shape sorter for young children with the ever-adorable Miffy and friends on the sides",11.99,Miffy,http://www.miffyshop.co.uk/miffy-wooden-stacking-blocks-1.html,Yes,Toys,miffyshapeshorter.jpg,Baby or toddler,Traditionalist,£10-25
11/15/2012 14:50:32,Soft plush doll,"Avoid the sinister gaze of plastic dolls with a softer, more appealing doll. She can be accessorised with various other items – and machine washed, for added practicality",24.95,NICI Wonderland,http://www.brightsparktoys.co.uk/bsn33231-minilina-plush-doll-_1081/,Yes,Toys,Minilinatoys.jpg,"Child, Baby or toddler",,£10-25
11/15/2012 14:52:57,Jumping Peppa,"You want to buy them traditionally crafted wooden toys handmade by the latest in a generation of craftsman residing in a remote rural idyll? Tough, this is what they actually want: a Peppa Pig who jumps enthusiastically in muddy puddles. Give in",18.97,Peppa Pig,http://www.bambinodirect.co.uk/Peppa_Pig_Jumping_in_Muddy_Puddles_Peppa___CHARACTER4454/version.asp?refsource=BAfroogle,Yes,Toys,peppapig.jpg,"Child, Baby or toddler",,£10-25
11/15/2012 15:00:21,Rocking horse,"The perfect combination of vintage appeal and child-friendly design, this beautiful little horse is durable and solid enough to be used from a very early age (around 9 months plus) and is low enough to allow little legs to clamber on. Doodle the horse even has a friend, Crumb the bird, to keep him company
",88.35,Little Bird Told Me,http://www.iglookids.co.uk/igloo-clothing-products/brand-little-bird-told-me/little-bird-told-me-doodle-and-crumb-rocker/4021/,Yes,"Toys, Luxury gifts",rockinghorse.jpg,"Child, Baby or toddler",Traditionalist,£50-100
11/15/2012 15:10:39,Adaptable trike,"A fantastic present for a pushchair-phobic baby, the Smart Trike adapts with them as they grow, from pushable and strapped-in safety as a baby to solo trike action as a toddler. It has good suspension for comfort and is extremely easy and quick to assemble. No batteries required and will last years",From 49.99,Smart Trike,http://www.elc.co.uk/on/demandware.store/Sites-ELCENGB-Site/default/Search-Show?q=SMART%20TRIKE,Yes,Toys,smarttrike.jpg,Baby or toddler,Outdoorsy type,£50-100
11/15/2012 15:14:31,Spherevelo,"A future design classic that will have passing babies turn their heads in envy, this bike, suitable for kids from around 12-30 months, is the perfect introduction to the balance bike",69,Early Rider,http://www.johnlewis.com/231733326/Product.aspx,Yes,"Toys, Gardens",Spherevelo.jpg,Baby or toddler,Design lover,£50-100
11/15/2012 15:24:02,Teal soft toy,"Most merchandise from kids TV programmes is not what you would call sweet: appealing to sticky fingers, yes, but definitely not their parents. These are an exception. In the same retro style as the CBeebies programme, the Abney and Teal soft toys are cuddly and appealing to fans and non-fans alike
",22.99,Abney & Teal,http://www.bbcshop.com/abney+teal/abney+teal-abney-30cm-plush/invt/at1160/,Yes,Toys,tealtoy.jpg,"Child, Baby or toddler",,£10-25
11/15/2012 15:30:18,Mittens on a string,"Things they don't make like they used to: wooden toys, shoes, stringed mittens. Well, actually, turns out Toby Tiger does. Hooray! An end to lost gloves",11,Toby Tiger,http://www.indiacoco.com/m3/Toby-Tiger/p358/Toby-Tiger-Girls-Multi-Stripe-Fleece-Lined-Mitts/product_info.html,Yes,"Kids clothes, Accessories",tobytigermittens.jpg,"Child, Baby or toddler",Outdoorsy type,£10-25
11/15/2012 15:33:23,Magnetic stacking rocket,"A simple and easy design, this wooden rocket is constructed from magnetic layers that young children can easily take apart and reassemble (though not necessarily in the right order)",16.99,Janod,http://www.toyella.com/toys/janod/stacking-magnetic-toy-rocket,Yes,Toys,toyellarocket.jpg,"Child, Baby or toddler",Design lover,£10-25
11/15/2012 15:49:12,Soft hot water bottle,A very cuddly winter warmer for older children and teenagers who still have a soft side (or are at least prepared to admit it),32,Graham & Green,http://www.grahamandgreen.co.uk/baxter-hot-water-bottle,Yes,"Toys, Homes/ decor",baxterhotwaterbottle.jpg,"Teenager, Child",Traditionalist,£25-50
11/15/2012 15:53:47,Set of suitcases,"Adorned with lovely illustrations of birds, these little suitcases are a great toy for children or a nice storage idea for teens – they'd be good for jewellery or tidying up small objects (well, you can but dream)",20,Magpie,http://www.magpieline.com/product/223/birdy-suitcases-set-of-3-nesting.html,Yes,"Toys, Homes/ decor, Accessories",birdysuitcasesfromamagpie.jpg,"Teenager, Child","Design lover, Traditionalist",£10-25
11/16/2012 8:48:25,Knitted jumper,"Everyone needs a Christmas jumper, and this one is festive enough for the day itself but not too decked in holly/Santa/reindeer, so will also be suitable for normal winter wear. Though if you want to wear a reindeer jumper in January, don't let us stop you",From 24,Boden,http://www.boden.co.uk/en-GB/Baby-0-4yrs-Knitwear/71203/Baby-0-4yrs-Winter-Jumper.html,Yes,Kids clothes,sarahLockbaubles.jpg,"Child, Baby or toddler",Traditionalist,£10-25
11/16/2012 8:52:58,Cut-out birds,"A photographic representation of birds, to cut out and stick together. A very cool stocking filler, for kids or adults. There's also a birds of prey set",6,Flights of Fancy,http://www.whippetgrey.co.uk/show_product.php?prod_id=1126,Yes,"Stocking fillers, Toys, Homes/ decor, Gardens, Stationery",cardbirdswhippetgrey.jpg,"Man, Woman, Teenager, Child","Design lover, Traditionalist",Under £10
11/16/2012 8:56:17,Card colouring-in sets,"A great, simple idea: Carddies consist of a set of card people in a box which children can carry around with them and colour in on the go. Brilliant for fidgety kids on planes, trains, in restaurants or just for some nice quiet time at home. You can but dream",8.99,Carddies,http://www.carddies.com/,Yes,"Toys, Stationery",carddies.jpg,"Teenager, Child",Design lover,Under £10
11/16/2012 8:59:49,Chalkboard T-shirts,"A T-shirt you are actually supposed to draw on? Admit it, you wish it came in adult sizes too. Just wipe off the drawings with a damp cloth so they can start all over again",18,Little Mashers,http://shop.littlemashers.com/chalk--tees-85-c.asp,Yes,"Kids clothes, Toys",chalktshirts.jpg,"Child, Baby or toddler",Design lover,£10-25
11/16/2012 9:02:41,Clothes plasters,"Another one of those brilliantly simple ideas you wonder why no one has done before: these very cool and robust designs can be simply ironed on to fabric – clothes, bags or even shoes",From 2.99,Jenny Maizels,http://shop.jenniemaizels.com/clothes-plasters-9-c.asp,Yes,"Stocking fillers, Kids clothes, Fashion, Accessories",clothesplasters2.jpg,"Teenager, Child, Baby or toddler",Design lover,Under £10
11/16/2012 9:06:32,Colour-in wallpaper,"Rolls of wallpaper with illustrations by Jon Burgerman that you colour in yourself. Not sure if this is a gift or therapy, but it will go down a treat with children and adults alike",36,CultureLabel.com x Maiden,http://www.culturelabel.com/d-i-y-colour-in-wallpaper.html,Yes,"Homes/ decor, Stationery",ColourInWallpaper4.jpg,"Man, Woman, Teenager, Child",Design lover,£25-50
11/16/2012 9:08:37,Dinosaur towel,"Part cosy post-bath towel wrap, part dressing-up clothes, this dinosaur cape (or is it a dragon?) will delight little children. Does not include roaring noises",39.99,Cuddledry,http://www.cuddledry.com/shop/9/58/the-amazing-cuddleroar,Yes,"Kids clothes, Toys",cuddledry.jpg,"Child, Baby or toddler",,£25-50
11/16/2012 9:16:55,Donkey slippers,"Very cute slippers made from Tibetan lambswool. Dyed using eco-friendly pigments and dried in the sun, they come in an organic cotton pouch 

",19.99,Sew Heart Felt,http://www.cotswoldtrading.com/Products/Sew-Heart-Felt-Darci-Donkey-Slippers.aspx,Yes,Kids clothes,DarciDonkeySlippers.jpg,Baby or toddler,"Traditionalist, Ethical",£10-25
11/16/2012 9:23:21,Build a volcano kit,"Seedling make great educational and fun kits for kids. This one exploits the natural chemical reaction between baking soda and vinegar to allow them to safely erupt a volcano in the comfort of your home
",30,Seedling,http://www.huggle.co.uk/products/Seedling-Build-Your-Own-Erupting-Volcano.html,Yes,Toys,eruptingvolcano.jpg,"Teenager, Child",Traditionalist,£10-25
11/16/2012 9:28:54,Facemaker blocks,"Miller Goodman makes toys that are modern design classics. This set of sustainable rubber-wood blocks will last years, and is just the sort of toy that gets stored in the attic for the next generation. Create characters and faces from the multi-faceted blocks
",31.98,Miller Goodman,http://www.toyella.com/toys/miller-goodman?gclid=CLWFmKSV07MCFaTMtAodvncABw,Yes,"Toys, Homes/ decor",FaceMaker002.jpg,"Child, Baby or toddler, Couples",Design lover,£25-50
11/16/2012 9:34:55,Reversible fleece,"Frugi's gorgeous snuggle fleeces come in a variety of colours but all are reversible, cosy and warm",32,Frugi,http://www.welovefrugi.com/girls/2-8-years/jumpers-cardigans/reversible-rainbow-snuggle-fleece/,Yes,Kids clothes,frugifleece.jpg,"Child, Baby or toddler",Outdoorsy type,£25-50
11/16/2012 9:37:45,Tunnocks T-shirt,A Tunnock's teacake T-shirt? Not so much a description as a tongue twister. A great design that also comes in different colours and on a variety of different products for kids and adults alike,15.75,Gillian Kyle,http://www.gilliankyle.com/collections/all-products/products/tunnocks-teacake-organic-kids-foil,Yes,Kids clothes,gilliankyle.jpg,"Child, Baby or toddler","Design lover, Ethical",£10-25
11/16/2012 9:40:39,Angel wings,"These wearable angel wings are really designed as decorations, but the temptation to adorn a grubby misbehaving child with them almost certainly will prove too much",22,Graham and Green,http://www.grahamandgreen.co.uk/feather-angel-wings,Yes,"Kids clothes, Homes/ decor",grahamandgreenangelwings.jpg,"Child, Baby or toddler",Traditionalist,£10-25
11/16/2012 9:43:20,Felt animal heads,"Although these are designed for children's bedrooms, we won't tell if you know a grown-up who would love to provide a home for them. Made of felt, you can (ethically) hunt down a zebra, giraffe, elephant or tiger",79,Graham and Green,http://www.grahamandgreen.co.uk/felt-animal-heads,Yes,"Homes/ decor, Decorations",grahamgreenanimalheads.jpg,"Teenager, Child, Baby or toddler, Couples",Design lover,£50-100
