11/21/2012 8:26:22,Fuzzy pizza,"Fuzzy felt will never go out of fashion, and this is a lovely spin on it: a pizza box that comes with a pizza-shaped book and 50 felt pieces. Kids can play and then make the real thing from the recipes that are included
",9.99,Templar books,http://www.templarco.co.uk/novelty/pizza_fun.html,Yes,Toys,pizzafuzzyfelt.jpg,"Child, Baby or toddler",,Under £10
11/21/2012 8:27:30,Disappointing diary,"Featuring wonderfully downbeat pages allowing you to note down 'Ideas you will never follow up' and 'People you own money', this diary is a cheeringly depressing stocking filler",10,Asbury & Asbury/Hat-trick Design,http://www.asburyandasbury.com/projects/disappointmentsDiary.html,Yes,"Stocking fillers, Stationery, Accessories",disappointingdiary.jpg,"Man, Woman, Teenager",Design lover,Under £10
11/21/2012 8:28:17,Lace beauty,"Absolutely beautiful cardigan from delicate Scottish lace – all Minna garments are made using environmentally friendly techniques. A wardrobe classic. Can you tell this is top of my wishlist?
",135,Minna,http://www.minna.co.uk/shop/product/frankie-lace-cardigan,Yes,"Fashion, Luxury gifts",minafrankiebolero.jpg,Woman,Ethical,+ £100
11/21/2012 8:29:47,Wolf brooch,"Made from fur scraps, Walter is sold in Minna's kids section but we think he's big enough and bad enough to hang out with adults",25,Minna,http://www.minna.co.uk/shop/product/walter-wolf-brooch,Yes,"Kids clothes, Jewellery, Accessories",minnawalterbrooch.jpg,"Woman, Teenager, Child",Ethical,£25-50
11/21/2012 8:36:10,DJ Puss,"OK, it's unlikely that your cat will take to DJing in a big way, but whack a bit of catnip on the turntable and you'll at least get an amusing photograph out of it",20,Suck UK,http://www.culturelabel.com/cat-scratching-dj-decks.html,Yes,Toys,catscratchingdecks.jpg,Pet,,£10-25
11/21/2012 8:42:21,Luxury beds,These gorgeous cushions are handmade from vintage Welsh blankets. Perfect for the truly pampered pooch or kitty,From 75,Sarah Moore Vintage,http://www.sarahmoorevintage.com/shop/welsh-blanket-cat-and-dog-beds/,Yes,"Homes/ decor, Luxury gifts",vintagecatbed.jpg,Pet,Traditionalist,£50-100
11/21/2012 8:45:29,Fish cat bowl,"Contains two removable, dishwasher-safe stainless steel bowls. Available in a range of colour, plus a bone design for dogs",20,Hing,http://www.thepetextraordinarium.com/hing-fish-cat-bowl-red,Yes,Food gifts,hingcatbowl.jpg,Pet,Design lover,£10-25
11/21/2012 8:48:05,Non-revolting pheasant,What every animal-loving peaceful dog needs: a squeaky pheasant toy to maul in the knowledge that no wildlife is being harmed,11.04,Purplebone,http://www.petspyjamas.com/product/soft-toys/pheasant-toy/PRP-00118?cat_id=2,Yes,Toys,Pheasantpurplebone.jpg,Pet,Traditionalist,£10-25
11/21/2012 8:50:47,Doggy bag,"What to get the pampered pooch who has everything? Possibly a course at a dog-training centre would be the ticket, but if you must spoil them, make like Paris Hilton and tote them round in a, um, tote",179,Mungo & Maud,http://www.mungoandmaud.com/Dogs/Dog-Bags/Brown-%26-Navy-Canvas-Dog-Carrier-Bag/21/,Yes,Luxury gifts,dogbagmundomaud.jpg,Pet,Outdoorsy type,+ £100
11/21/2012 8:54:04,Tweed coat,Keep a dapper dog looking stylish and warm this Christmas,32.99,Purplebone,http://www.petspyjamas.com/product/coats/tweed-dog-coat/PRP-00109?cat_id=2,Yes,Accessories,TweedPurplebone.jpg,Pet,Traditionalist,£25-50
11/21/2012 8:57:04,Cat laser toy,For design-loving cats who can't bear the cutsie stuffed-mouse vibe,6.25,Ethical Products,http://www.petspyjamas.com/product/chew-toys/bella-rockin-laser/PTC-00098?cat_id=3,Yes,Toys,catlasertoy.jpg,Pet,Ethical,Under £10
11/21/2012 9:00:06,Pudding bed,"Don't forget your tiniest little friends this Christmas. Though to be honest, if they made this adult-sized, we'd buy one for ourselves and hibernate until March",2.99,Rosewood,http://www.omlet.co.uk/shop/hamsters_and_gerbils/hamster_toys/14812/christmas_pudding_bed_for_small_animals/,Yes,"Stocking fillers, Homes/ decor",Christmaspuddingbed.jpg,Pet,Traditionalist,Under £10
11/21/2012 9:03:17,Radiator bed,"A cosy bed/hiding place that hangs off a radiator for extra warmth and snuggliness. Who wouldn't want this? Well, aside from any contrarian cat. Which is pretty much all of them, isn't it?",24.99,Jolly Moggy ,http://www.omlet.co.uk/shop/cat_products/cat_beds/12886/bamboo_radiator_bed/,Yes,Homes/ decor,radiatorbed.jpg,Pet,Traditionalist,£10-25
11/21/2012 9:05:44,Codfather gift set,"Tuxedo-clad fish containing catnip. Get these, then leave a toy horse's head in your cat's bed? ",6,Ruff and Tumble,http://www.petsathome.com/shop/the-cod-father-cat-gift-set-by-ruff-n-tumble-99753?freeText=codfather&msg=MSG_SEARCH_ONE_MATCHING_PRODUCT,Yes,Toys,petsathomecodfather.jpg,Pet,Traditionalist,Under £10
11/21/2012 9:08:41,Hug a hoodie,"Dress up your dog for Christmas. Comes in a range of canine sizes. Not included: dog, expression of resigned but deep despair",9,Pets at Home,http://www.petsathome.com/webapp/wcs/stores/servlet/Search?freeText=reindeer+hoodie&x=0&y=0&storeId=10551&catalogId=10601&langId=-1,Yes,Fashion,petsathomedoghoodie.jpg,Pet,Traditionalist,Under £10
11/21/2012 9:15:57,Green hair,This great-value range from Faith in Nature is paraben-free and perfect for green stockings,5.2,Faith in Nature,http://www.ethicalsuperstore.com/products/faith-in-nature/?PCode=FSGESS15&gclid=CNSAsc3c37MCFQzKtAodkAsALg,Yes,"Stocking fillers, Beauty",faithinnature.jpg,"Woman, Teenager",Ethical,Under £10
11/21/2012 9:19:38,Lovely animal frocks,"Wonderful little handmade dresses from Wild Things – there are an array of adorably cute animals to chose from. The dresses are robust, stand up well to repeated washing and will charm parents and small people alike",From 34,Wild Things,http://www.etsy.com/shop/wildthingsdresses,Yes,"Kids clothes, Fashion",wildthings.jpg,"Child, Baby or toddler",Traditionalist,£25-50
11/21/2012 9:23:33,Junior masterchef,"Great stocking fillers for little creative cooks, Tala's retro-inspired baking range for kids includes cookie cutters, mini whisks and a measuring jug",From 2.99,Tala,http://www.mollieandfred.co.uk/advanced_search_result.html?y=0&x=0&keyword=tala&wizid=s9b74p6onoarh0bd0g4t35aa96&search_in_description=0,Yes,"Toys, Food gifts",talacooking.jpg,"Child, Baby or toddler",Traditionalist,Under £10
11/21/2012 9:32:43,Wonderful wallets,"Really beautifully made wallets inspired by musician-owner Ryan Barr's love of vintage guitars. It has a unique little pocket for a guitar pick as well as slots for all your less musical stuff. The Wanted Wallets site also has tonnes of other unusual brands, so do browse for other ideas",35,Whipping Post,http://www.wantedwallets.com/wallets/whipping-post-wallets-41.html,Yes,"Accessories, Luxury gifts",whippingpost.jpg,Man,Design lover,£25-50
11/21/2012 9:35:17,Cycle in style,"Beautifully cut and designed apparel designed with cyclists in mind, this long sleeve merino jersey may be perfect for riding, but is also stylish enough for all-day wear. Vulpine also make women's riding wear",85,Vulpine CC,http://www.vulpine.cc/Shop,Yes,"Fashion, Luxury gifts",vulpine.jpg,"Man, Woman","Outdoorsy type, Design lover",£50-100
11/21/2012 9:44:44,Sleepy time,Want to make sure you don't wake up when Father Christmas is delivering the presents? Then make sure this is hanging on the tree. Gentle lavender-infused balm to relax even the most over-excited mind,10,This Works,http://www.feelunique.com/p/this-works-Beauty-Ball-Silent-Night-Sleep-Balm-10g?q=this,Yes,"Decorations, Beauty",thisworksbalm.jpg,"Man, Woman, Teenager",Traditionalist,Under £10
11/21/2012 9:52:50,Dinosaur island,"Fabulous little self-assembly kit including waterfall, trees, volcano and dinosaurs. Not including: roaring noises, screaming",59.99,Bigjigs Toys,http://shop.bigjigstoys.co.uk/p/dinosaur-island,Yes,Toys,bigjigsdinoisland.jpg,"Child, Baby or toddler","Traditionalist, Ethical",£50-100
11/21/2012 10:00:32,Crochet rattles,"Adorable little crocheted rattles that you won't mind being whacked over the head with, and can cope with some gummy chewing, too",12.99,Sebra,http://www.kidsen.co.uk/crochet-deer-rattle.html,Yes,Toys,kidsenrattles.jpg,Baby or toddler,Traditionalist,£10-25
11/21/2012 10:08:08,Cashmere scarf,"For modern, understated but beautifully made classics for both men and women, head to Loft Design By. Gorgeous wardrobe staples",110,Loft Design By,http://www.loftdesignby.com/accessoires/echarpes-bonnet-et-gants/franz-1.html,Yes,"Fashion, Accessories, Luxury gifts",loftscarf.jpg,"Man, Woman",Design lover,£50-100
11/21/2012 13:42:33,Beautiful brownies,"The squidgiest, tastiest brownies and most mouth-watering chocolate imaginable, all wrapped up in lovely gift sets to send by mail. Send them direct or you'll end up drooling all over the packaging, which is not a good festive look",From 9.60,Cocoaloco,http://www.cocoaloco.co.uk/acatalog/Organic_Chocolate_Selections_GiftBox.html,Yes,Food gifts,cocolocobrownies.jpg,"Man, Woman, Teenager, Couples",Traditionalist,£10-25
11/21/2012 14:34:36,Simple watches,"A rainbow of shades to satisfy all tastes, these simple watches come in packaging inspired by the tuna can. Something to remember on the morning commute. Or is that sardines?",29,OClock,http://www.steadyguy.co.uk/O-CLOCK-WATCHES,Yes,Accessories,oclockwatch.jpg,"Man, Woman, Teenager",Design lover,£25-50
11/21/2012 15:01:09,Mulled wine sachets,"It's a miserable Scrooge indeed who doesn't love a mug of mulled wine at Christmas. These lovely little spice bouquets make the process easier. Just add wine, and orange juice and brandy if you prefer",4.5,Weanie Beans,http://weaniebeans.com/shop/Mulled%20Wine%20Spice%20Bouquets,Yes,"Stocking fillers, Food gifts",mulledwine.jpg,"Man, Woman",Traditionalist,Under £10
11/21/2012 15:09:07,Commuter kit,"The perfect gift for someone who spends way too much time on public transport. Or indeed in their own car. The Aeropress means they can brew up delicious coffee on the go. The kit comes with a cup, the press, a particularly nice coffee blend and a tea towel, in case of accidents",40,Weanie Beans,http://weaniebeans.com/shop/Commuter%20Coffee%20Kit,Yes,Food gifts,weaniebeans.jpg,"Man, Woman, Couples",Outdoorsy type,£25-50
11/21/2012 15:15:14,Yorkshire hamper,"Food hampers are 10 a penny but this one is really special. Full of sweet treats from Lottie Shaw, including some wonderfully fiery parkin biscuits, a dangerously moreish fruitcake and some light and tasty mince pies. And that's just for starters
",45,Lottie Shaw,http://www.loveyourlarder.com/lottieshaws/lottieshawsseriouslygoodyorkshirechristmashamper,Yes,"Food gifts, Luxury gifts",loveyourlarder.jpg,"Man, Woman",Traditionalist,£25-50
11/21/2012 15:39:10,Decadent delight,"The chocolate connoisseur in your life is not going to be happy with a box of Quality Street, are they? Impress them instead with this gift box from premium brand La Maison du Chocolat. It blends traditional festive flavours – spices, praline, champagne with the purest of chocolate. Yum",45,Le Maison du Chocolat,http://www.lamaisonduchocolat.co.uk/uk/en/product/christmas-star-gift-box-32-chocolates,Yes,"Food gifts, Luxury gifts",maisonchocolat.jpg,"Man, Woman",Traditionalist,£25-50
11/22/2012 9:07:38,Lovely notebooks,"The highest quality little notebooks from a genuinely historic company. The detail – for example, page numbers for helpful indexing – is brilliant. Pick up one of the in-book pen loops as well – you'll never have to fish around in your bag for a lost Biro again",From 2.95,Leuchtturm 1917,http://www.thepaperie.co.uk/brands/leuchtturm1917?gclid=CKap75ac4rMCFU3HtAod2kUAbQ,Yes,"Stocking fillers, Stationery",leuchtturm1917.jpg,"Man, Woman, Teenager, Couples",Design lover,Under £10
11/23/2012 14:34:54,Bliss bag,"A reviving treat of lemon with seasonal sage (it's wasted on the turkey)
",39,Bliss ,http://www.blissworld.co.uk/gifts/bliss-merry-citrus-lemon-sage-gift-set/,Yes,Beauty,bliss.jpg,"Woman, Teenager",Traditionalist,£25-50
11/19/2012 15:36:12,Electric guitar,For little rockers-in-training,40,John Lewis,http://www.johnlewis.com/231303504/Product.aspx,Yes,"Toys, Gadgets",electricguitar.jpg,Teenager,Culture vulture,£25-50
11/19/2012 15:37:33,Leather bracelets,Perfect for teens to layer up and show off,44,Annie Haak Designs,http://www.anniehaakdesigns.co.uk/bracelets/wanti-wanti-wrap-silver-leather-cord-friendship-bracelets#.UKKPFr9nFE4,Yes,"Jewellery, Accessories",cordbracelets.jpg,"Woman, Teenager","Traditionalist, Outdoorsy type",£25-50
11/19/2012 15:38:42,Champagne flutes,Suitibly glitzy vessels for the Christmas morning fizz,30,LSA,http://www.lsa-international.com/type/wine-water-glasses/red-wine-glass-x-4.html,Yes,"Homes/ decor, Food gifts",Champagneglass.jpg,"Man, Woman, Couples",Design lover,£25-50
11/19/2012 15:44:56,"Socks. Yes, socks",Toast says these are house socks. They are wrong. They are awesome wellington boot socks,29,Toast,http://www.toast.co.uk/product/slippers+and+socks/FPPP8/ARAN+KNIT+HOUSE+SOCK.htm?categoryref=%2fcategory.aspx%3fcategoryid%3dslippers%2520and%2520socks%26seoterm%3dslippers%2520socks%26&pcat=slippers+and+socks&adimage=&clr=FPPP8_deepred,Yes,"Gardens, Accessories, Fashion",toastsocks.jpg,Woman,Outdoorsy type,£25-50
11/19/2012 15:46:36,Men's skincare,"The perfect gift for a man who wants good grooming in a simple, gentle routine",38.8,Liz Earle,http://uk.lizearle.com/everyday-skincare-offer,Yes,Beauty,mensskincare.jpg,Man,Traditionalist,£25-50
11/19/2012 15:47:59,Grown up mittens,You'll score top fashion points with these Markus Lupfer for Whistles mittens,45,Whistles,http://www.whistles.co.uk/fcp/categorylist/dept/Accessories?resetFilters=true#ID=id_903000059064_markus_GBP&category=markus,Yes,"Fashion, Accessories",mittens.jpg,"Woman, Teenager",Outdoorsy type,£25-50
11/19/2012 15:54:13,Necklace,Carrie and the SATC crew may be off our screens now but the name necklace trend will just keep on going,45,Anna Lou of London,http://www.annalouoflondon.com/productdetails.asp?id=3295,Yes,Jewellery,namenecklace.jpg,"Woman, Teenager",Traditionalist,£25-50
11/19/2012 15:57:45,Cube Bot,A jolly antidote to the plethora of plastic in toy departments,29.99,Addject Ltd,http://www.notonthehighstreet.com/addject/product/cube-bot-large,Yes,"Toys, Gadgets",cubebot.jpg,"Teenager, Child, Baby or toddler",Design lover,£25-50
11/19/2012 15:59:16,Mobile speakers,"Tiny, portable laptop speakers.",31.95,Chill Pill,http://www.chemical-records.co.uk/sc/servlet/Info?Track=CPA001,Yes,"Accessories, Gadgets",portablespeakers.jpg,"Man, Woman, Teenager",Culture vulture,£25-50
11/19/2012 16:00:45,Beluga Vodka,"Yotam Ottolenghi recommends it. No hangover, apparently (not guaranteed)",34.95,Beluga,http://www.thewhiskyexchange.com/P-9930.aspx,Yes,Food gifts,belugavodka.jpg,"Man, Woman, Couples",Traditionalist,£25-50
11/19/2012 16:02:02,BFI Membership,"Become a member of the BFI (British Film Institute) Southbank, which gets you all sorts of booking privileges",40,BFI,http://filmstore.bfi.org.uk/acatalog/BFI_Gift_Membership.html,Yes,Accessories,membership.jpg,"Man, Woman",Culture vulture,£25-50
11/19/2012 16:04:53,Bowl,The cutest dog bowl you can buy. Probably,35,Fenella Smith,http://www.fenellasmith.com/store/animals/pug-rectangular-dogbowl,Yes,Homes/ decor,dogbowl.jpg,Pet,"Traditionalist, Design lover",£25-50
11/19/2012 16:07:26,Cosy cashmere,"This kind of wintry weather requires a woolly hat, and if it's cashmere then all the better",95,Brora,http://www.brora.co.uk/Product/Product.aspx?WebShopCodeStr=A2&WebSegmentCodeStr=S5&WebCategoryCodeStr=CV&StyleCodeStr=WJ605&PT=1&PC=A2-S5-CV#,Yes,"Fashion, Accessories, Luxury gifts",cashmerehat.jpg,"Woman, Teenager",Outdoorsy type,£50-100
11/19/2012 16:09:03,Popcorn maker,Perfect for the film-night enthusiast,59.95,Selfridges,http://www.selfridges.com/en/Home-Tech/Categories/Shop-Home/Kitchen-electrical/Cooking-appliances/Retro-Series-hot-air-popcorn-maker_306-3002761-RHP625/?cm_mmc=SEO-_-google-_-googleshopping-_-Nostalgia+Electrics&_$ja=tsid:32977|cc:|prd:22729583|cat:Home+%26+Tech+%3E+Categories+%3E+Shop+Room+%3E+Kitchen+%3E+Kitchen+electrical+%3E+Cooking+appliances,Yes,"Homes/ decor, Food gifts",popcornmaker.jpg,"Man, Woman, Teenager, Couples",Traditionalist,£50-100
11/19/2012 16:13:46,iPad case,Proof that an iPad case doesn't have to be utilitarian,60.5,Tovicorrie,http://www.etsy.com/listing/108985680/leather-ipad-case-hummingbirds-in-floral,Yes,"Fashion, Gadgets, Accessories",ipadcase.jpg,Woman,Design lover,£50-100
11/19/2012 16:15:35,Clock on the cards,"Cards from a 1930s spelling game make this clock tick tock.
Reader offer: Get 10% off when you use the code GUR10. Valid until 20 December",75,Vintage Playing Cards,http://www.vintageplayingcards.co.uk/shop/clock-frames/letter-frame-clocks/tick-tock-clock/,Yes,Homes/ decor,playingcardclock.jpg,"Man, Woman, Couples",Design lover,£50-100
11/19/2012 16:16:50,Ride-on Vespa,One for the mini-mod in your life,75,Museum of London,http://www.museumoflondonshop.co.uk/store/product/29841/Wooden-Vespa/,Yes,"Toys, Luxury gifts",vespa.jpg,Child,Design lover,£50-100
11/19/2012 16:18:21,Anya Hindmarch wash bag,For 'Girlie Stuff' only,95,Anya Hindmarch,http://www.giftlab.com/uk/pink-girlie-stuff-wash-bag,Yes,"Fashion, Accessories, Luxury gifts",washbag.jpg,Woman,Design lover,£50-100
11/19/2012 16:36:17,Duffle bag,"Ideal for adventures.
Reader offer: Get 10% off when you use the code GUARDIAN10. Valid until 24 December",80,Pretty Green,http://www.prettygreen.com/shop/product/canvas-stone-duffle-bag/,Yes,"Fashion, Accessories",dufflebag.jpg,"Man, Teenager","Outdoorsy type, Design lover",£50-100
11/19/2012 16:38:24,Sex Pistols Deluxe,Nothing says Christmas quite like a previously unreleased studio version of Belsen Was A Gas,95,HMV,http://hmv.com/hmvweb/displayProductDetails.do?ctx=280;0;-1;-1;-1&sku=868007,Yes,"Accessories, Luxury gifts",sexpistols.jpg,"Man, Woman, Teenager",Culture vulture,£50-100
11/19/2012 16:45:56,A' stool,Interlocking As make this this coolest of stools,75,By Alex,http://www.byalex.co.uk/a_stool.html,Yes,Homes/ decor,sexpistols.jpg,"Man, Woman, Couples","Design lover, Ethical",£50-100
11/19/2012 16:52:18,National Art Pass gift box,"Art with benefits, including free entry to over 200 museums and galleries",From 60,Art Fund,http://www.artfund.org/shop/gift-national-art-pass,Yes,"Homes/ decor, Luxury gifts",artpass.jpg,"Man, Woman, Couples",Culture vulture,£50-100
11/19/2012 16:55:03,Purse,A little purse sprinkled with bright and cheerful stars,69,Commes des Garcons,https://shop.doverstreetmarket.com/product_info.php?products_id=7324,Yes,"Fashion, Accessories, Luxury gifts",starpurse.jpg,"Man, Woman, Teenager",Traditionalist,£50-100
11/19/2012 16:56:23,Leather jewellery box,Storing jewellery can be tricky business but this elegant box can come to the rescue,72,Life of Riley,http://www.notonthehighstreet.com/lifeofriley/product/leather-ring-box,Yes,"Jewellery, Luxury gifts",jewellerybox.jpg,Woman,Traditionalist,£50-100
11/19/2012 16:58:27,Toy box and desk,A colourful and useful way to sweep away the toys,99,Millhouse at Home,http://www.millhouseathome.co.uk/products/details/317.html,Yes,"Toys, Homes/ decor",toyboxdesk.jpg,"Child, Couples",Traditionalist,£50-100
11/19/2012 16:59:42,The Great British Hamper,"Cheddar, pickle, marmalade - a hamper for a real British feast.
Reader offer: Get 10% off when you use the code G12. Valid until 10 December",95,Whisk Hampers,http://www.whiskhampers.co.uk/products/gifts/gift_hampers/the_great_british_hamper.html,Yes,Food gifts,hamper.jpg,"Man, Woman, Couples","Traditionalist, Outdoorsy type",£50-100
11/19/2012 17:00:54,Candle Holder,Beautiful brass candle holder with a smooth finish,90,Georg Jensen,http://www.harrods.com/product/ilse-brass-candleholder/georg-jensen/000000000003009812?cat1=bc-georg-jensen-accessories&cat2=bc-georg-jensen-home,Yes,Homes/ decor,candleholder.jpg,"Man, Woman, Couples",Design lover,£50-100
11/19/2012 17:04:31,Classic knit,A cosy and classic knit is always appreciated.,125,Aubin and Wills,http://www.aubinandwills.com/en-gb/product/oakdene-crew-01560400101,Yes,"Fashion, Luxury gifts",mensjumper.jpg,Man,Traditionalist,+ £100
11/19/2012 17:06:23,Fold-up bike,"Quick and easy to fold, great price for a folding bike",329.99,Tilt,http://www.decathlon.co.uk/folding-bike-tilt-5-asphalt-id_8202736.html,Yes,Luxury gifts,foldupbike.jpg,"Man, Woman",Outdoorsy type,+ £100
11/19/2012 17:08:54,Friendship bracelet,"Buy bracelets and rings, so the lucky recipient can look at them all day. Reader offer: Get 15% off and free delivery for all products (except gift vouchers) with the code GUARDIAN15. Valid until 15 December.",165,Astley Clarke,http://www.astleyclarke.com/uk/18-carat-yellow-gold-vermeil-rainbow-gemstone-friendship-bracelet-d30516,Yes,"Jewellery, Luxury gifts",AstleyClarke.jpg,Woman,Traditionalist,+ £100
11/19/2012 17:10:13,Fuji XF1,A hi-tech camera with a retro look. Ideal for aspiring photographers (and hipsters),399,Fujifilm,http://www.fujifilm.eu/uk/products/digital-cameras/pro-enthusiast/model/xf1/,Yes,"Gadgets, Luxury gifts",camera.jpg,"Man, Woman, Teenager",Culture vulture,+ £100
11/19/2012 17:11:39,Vintage coffee machine,Perfect coffee from a very stylish machine,189.95,De'Longhi,http://www.johnlewis.com/231706528/Product.aspx,Yes,"Homes/ decor, Gadgets, Luxury gifts",coffeemachine.jpg,"Man, Woman, Couples",Design lover,+ £100
11/19/2012 17:12:47,Screenprinted tote,A striking and practical bag for the bold,130,Darkroom,http://www.darkroomlondon.com/index.php/shop/detail/darkroom-aztec-screen-printed-blue-tote-small/,Yes,Accessories,Aztectote.jpg,Woman,Design lover,+ £100
11/19/2012 17:13:43,Knot studs,Suit-all delicate earrings from British designer Ruth Tomlinson,180,Ruth Tomlinson,http://ruthtomlinson.com/shop/view/sketch/earrings/15#rtse1g,Yes,Jewellery,knotstuds.jpg,Woman,Design lover,+ £100
11/19/2012 17:16:23,The James Bond Archives,"Peter Bradshaw says ""Mouthwatering photographs, gorgeously reproduced.""",135,Taschen,http://www.taschen.com/pages/en/catalogue/film/all/00399/facts.the_james_bond_archives.htm,Yes,Luxury gifts,jamesbondbook.jpg,"Man, Woman, Teenager","Culture vulture, Traditionalist",+ £100
11/19/2012 17:20:14,Vintage maps,"Paris, London, Hull... Pick any three places that hold meaning to personalise this pressie. 
Reader offer: Get £20 off all orders over £75 when you use the code GUARDIAN20. Valid until 31 January",125,Bombus,http://www.bombus.co.uk/shop/view/bespoke-map-art/bespoke-map-circles/trio-vintage-circles/,Yes,Homes/ decor,maptrio.jpg,"Man, Woman, Couples",Design lover,+ £100
11/19/2012 17:24:23,UniformWare watch,Beautifully simple designs for both men and women,280,UniformWares,http://www.uniformwares.com/203-series-brushed-steel-or-blue-leather,Yes,Jewellery,bluewatch.jpg,"Man, Woman",Design lover,+ £100
11/19/2012 17:25:47,Bose Wave ,A clock radio on steroids: incredible sound (and incredible price ...),429.95,Bose,http://www.bose.co.uk/GB/en/home-and-personal-audio/wave-systems/wave-radios/wave-radio-iii/,Yes,"Homes/ decor, Luxury gifts, Gadgets",boseradio.jpg,"Man, Woman, Couples","Culture vulture, Design lover",+ £100
11/19/2012 17:36:14,Roasting tin,"Yotam Ottolenghi pines for one. Make his year?
Reader offer: Get 10% off with the code PA0016876108. Valid until 31 December",205,Mauviel,http://www.cooksparaphernalia.co.uk/cookware-group/mauviel-mheritage-copper-roasting-pans.html,Yes,"Food gifts, Luxury gifts",roastingtin.jpg,"Man, Woman",Traditionalist,+ £100
11/19/2012 17:51:07,Spanner bottle opener,A bottle opener to store discreetly in the tool box. No one will ever know ...,8,Unique and Unity,http://www.uniqueandunity.co.uk/all-kitchen-products/hairy-bikers-spanner-bottle-opener.html,Yes,"Food gifts, Homes/ decor, Stocking fillers",spannerbottleopener.jpg,Man,Traditionalist,Under £10
11/19/2012 17:52:46,Herb holders,"Why have plant pots that look like plant pots when they can look like little tea pots? 
Reader offer: To get 30% off, call 020 7627 6767 and quote 'Reader offer'. Valid until 8 December",10,Talking Tables,http://www.talkingtables.co.uk/ranges/give-what-you-grow/1034/give-what-you-grow-herb-holders/,Yes,"Gardens, Food gifts",herbpot.jpg,"Man, Woman, Teenager, Couples",Outdoorsy type,Under £10
11/19/2012 17:53:56,Measuring cups,For precise chefs who like a splash of colour with their cooking,10,Joseph Joseph,http://www.johnlewis.com/231403084/Product.aspx,Yes,Food gifts,measuringspoons.jpg,"Man, Woman",Design lover,Under £10
11/19/2012 17:55:44,Socks,Socks are a safe bet and the bicycle print on these makes them a fun choice,3,Topman,http://www.topman.com/webapp/wcs/stores/servlet/ProductDisplay?beginIndex=1&viewAllFlag=&catalogId=33056&storeId=12555&productId=7886442&langId=-1&sort_field=Relevance&categoryId=795517&parent_categoryId=207169&pageSize=200,Yes,"Fashion, Stocking fillers",bicyclesocks.jpg,Man,Traditionalist,Under £10
11/19/2012 17:57:52,Bee-friendly seed collection,"Nectar and pollen-rich flowers that are cut-and-come-again - some for you, some for the bees.
Reader offer: Get 10% off all Higgledy products ordered online using the code FoxBaseAlpha. Valid until 15 December",10,Higgledy Garden,http://higgledygarden.com/products-page/seed-collections/bee-friendly-seed-collection,Yes,Gardens,seeds.jpg,"Man, Woman",Outdoorsy type,Under £10
11/19/2012 17:59:18,Tea towel,Tongue twisting distraction while doing the dishes,8.99,The Oak Room,http://oakroomshop.co.uk/celebrationseasonal/christmasgifts/giftsunder10/tongue-twister-tea-towel,Yes,Homes/ decor,teatowel.jpg,"Man, Woman, Couples",Traditionalist,Under £10
