11/19/2012 10:20:22,Knit your own hat,"A luxury hat-knitting kit using super-soft alpaca wool – or, if you just love the style but couldn't knit your way out of a ball of wool, you can rent a wizard knitter to have it made up for you",31,Toft Alpaca,http://www.thetoftalpacashop.co.uk/PD.aspx?product=READY_TO_KNIT/KNITTING_KITS/hat_kits-Pom_Pom_Hat,Yes,"Craft, Accessories, Luxury gifts",toftalpacakits.jpg,"Woman, Teenager","Traditionalist, Ethical",£25-50
11/19/2012 10:24:14,Stylish knits,"Knitting kits for those of a stylish bent – these fantastic kits from Wool and the Gang contain absolutely everything you need for the individual items, from the easy to the more advanced",From 40,Wool and the Gang,http://www.woolandthegang.com/en/collections/index/type:kits/collection:/page:all/level:/cat:/style:2,Yes,"Kids clothes, Craft, Accessories, Luxury gifts",woolandthegang.jpg,"Woman, Teenager",Design lover,£25-50
11/19/2012 10:49:26,App controlled helictoper,"Possibly this is designed for kids, but they won't get a look in; it's far too enjoyable. Turn your smartphone (either iOS and Android – John Lewis has a good list of compatible phones) into an intuitive remote control and fly missions galore. Cleverly, the batteries are built in and chargeable via USB, so it won't go dead sometime on Christmas Day evening either",39.95,AppToyz,http://www.johnlewis.com/231663168/Product.aspx,Yes,"Gardens, Gadgets",AppCopter.jpg,"Man, Woman, Teenager, Child, Couples",,£25-50
11/19/2012 10:53:33,Lego campervan,"First, the technical details: it's a replica of the classic Volkswagen T1 Camper Van from 1962. The details are incredible inside and out, with everything from gear stick to folding dining table lovingly rendered. Second, and more to the point, there is nothing more enjoyable and absorbing than assembling it. Give it as a gift and you'll not hear a peep from the recipient, bar the odd request for mulled wine
",79.95,Lego,http://www.johnlewis.com/231693603/Product.aspx,Yes,"Toys, Homes/ decor, Luxury gifts, Gadgets",campervan.jpg,"Man, Woman, Teenager, Couples",Design lover,£50-100
11/19/2012 10:59:03,Personalised cases,"Giant Sparrows has a range of particularly nice, arty smartphone covers, from Frida Kahlo to Hiroshige – but you can also upload a more personal image, from family photos to a pet dog, and get it printed out ",19.99,Giant Sparrows,http://www.giantsparrows.co.uk/,Yes,"Homes/ decor, Gadgets",iphonecases.jpg,"Man, Woman, Teenager","Design lover, Traditionalist",£10-25
11/19/2012 11:04:23,Jessops Academy vouchers,"A new range of courses at Jessops, with venues all across the UK, offers instruction in all sorts of areas from DSLR and compact cameras to wedding. Great gift for an enthusiastic amateur or someone looking to take it up professionally. Or, why not try one of the Guardian's very own masterclasses in photography?
",From 119,Jessops,http://advice.jessops.com/academy.aspx,Yes,"Luxury gifts, Gadgets",jessopsvoucher.jpg,"Man, Woman, Teenager","Outdoorsy type, Design lover",+ £100
11/19/2012 11:29:19,IPad case,"Simple stylish iPad cover from Kate Sheridan's lovely range, which also includes Kindle and laptop cases in a variety of colours",19,Kate Sheridan,http://www.katesheridan.com/p435/Slate-Triangle-Grid-IPad-cover/product_info.html,Yes,"Accessories, Gadgets",katesheridanipadcase.jpg,"Man, Woman, Teenager",Design lover,£10-25
11/19/2012 11:36:04,Windproofing for microphones,"A brilliant gift for an enthusiastic amateur film-maker or dabbler, this mini muff (no sniggering at the back, thanks) will eliminate the problem of wind (stop it now) from the audio of films shot on DSLR",12.95,micromuff,http://www.micromuff.com/,Yes,Gadgets,micromuff.jpg,"Man, Woman, Teenager",Outdoorsy type,£10-25
11/19/2012 11:39:51,Nike+ FuelBand,"The Nike+ FuelBand is somewhere between an activity monitor, a pedometer and a game. It measures your everyday activity and helps you hit a goal you've set yourself – and measure up against friends. It's also a pleasingly lovely piece of design: the bracelet lights up to give you progress or just the time, and it wirelessly syncs to the app on your iOS device. Ideal for a gadget-lover who wants to get moving",129,Nike,"http://store.nike.com/gb/en_gb/?l=shop,pwp,c-300/f-787+793+1037465&cp=EUNS_KW_UK_Sportswear_Equipment_Brand",Yes,"Accessories, Gadgets",nikefuelband.jpg,"Man, Woman, Teenager",Outdoorsy type,+ £100
11/19/2012 12:08:47,Harris tweed iPad sleeve,"Hand woven, dyed and spun by islanders in the Outer Hebrides of Scotland, made from pure virgin wool. Because the best-dressed iPad deserves nothing less",55,CultureLabel.com x Breagha ,http://www.culturelabel.com/harris-tweed-pink-city-ipad-sleeve.html,Yes,"Accessories, Gadgets",pinkipadcase.jpg,"Woman, Teenager","Design lover, Traditionalist, Ethical",£50-100
11/19/2012 12:18:07,Top quality headphones,"Fantastic quality headphones at an extremely reasonable price, RHA designs and engineers all its range from its base in Glasgow. There are earphone models with remotes, but we particularly recommend the SA950i headphone model",49.95,RHA,http://www.rha-audio.com/headphones/sa950i.html,Yes,"Luxury gifts, Gadgets",RHAheadphones.jpg,"Man, Woman, Teenager","Design lover, Culture vulture",£25-50
11/19/2012 12:20:17,iPad pen,"A fantastic little stylus pen for the iPad, perfect for drawing apps but also a great chunky size for smaller hands",9.99,Scribbly,http://www.scribbly.eu/stores/page_code_forward.do?pubID=8569&pageCode=HOME_CUSTOM,Yes,"Stocking fillers, Gadgets",Scribblypens.jpg,"Man, Woman, Teenager, Child, Baby or toddler",Design lover,Under £10
11/19/2012 14:18:26,Laptop cases,"Essentially a stylish coat for your laptop (Speck also does other cases for smartphones and tablets), this case comes in a range of great fabric-backed prints",39.95,Speck,http://www.speckproducts.com/fitted-for-macbook-pro-13-freshbloom-teal.html,Yes,Gadgets,speckcase.jpg,"Man, Woman, Teenager",Design lover,£25-50
11/19/2012 14:21:29,Blinking bands,"A handy gift for a keen runner or cyclist, these bands are reflective and have four blinking lights to help nighttime visibility and safety",14,Sweaty Betty,http://www.sweatybetty.com/reflective-arm-blink-prodarmblink_fluroyellow/,Yes,"Accessories, Gadgets",sweatybettyrunningband.jpg,"Man, Woman, Teenager",Outdoorsy type,£10-25
11/19/2012 14:27:23,Iphone covers,"Lovely cases featuring designs by the talented Bristol artist Tom Frost. There are four designs celebrating British wildlife: an otter, an owl, a hare and a fox",12,Magpie,http://www.magpieline.com/product/288/wildlife-i-phone-case-hare.html,Yes,"Accessories, Gadgets",tomfrostcases.jpg,"Man, Woman, Teenager",Design lover,£10-25
11/19/2012 14:35:35,Wool jumper,Super snuggly-warm wool jumper with a cotton lining in a classic design,99,Boden,http://www.boden.co.uk/en-GB/Mens-Knitwear/MK112-MGR/Mens-Mid-Grey-Marl-Zip-through-Fair-Isle.html,Yes,"Fashion, Luxury gifts",Bodenzipjumper.jpg,Man,"Outdoorsy type, Traditionalist",£50-100
11/19/2012 14:38:40,Red clutch bag,"If you're feeling generous and want to splash out on a designer gift, these beautiful leather clutch bags from Bora Aksu are just the ticket. An expensive ticket, we grant you, but a very stylish one ",365,Bora Aksu,http://shop.boraaksu.com/collections/accessories?page=1,Yes,"Fashion, Accessories, Luxury gifts",BoraAksu.jpg,Woman,Design lover,+ £100
11/19/2012 14:41:52,Collar,A beautiful velvet-and-ruffle collar from the treasure trove that is Boticca – browse it for a huge array of great independent designers and makers selling their wares from around the world,51,Gemma Lister,http://boticca.com/gemma-lister/navy-velvet-and-ruffle-collar/,Yes,"Jewellery, Accessories, Luxury gifts",boticcacollar.jpg,Woman,Design lover,£50-100
11/19/2012 14:44:42,Roque leather bag,"A beautiful leather laptop bag built to last, and named after the most famous cafe in Buenos Aires, apparently. The same company also makes some particularly stylist weekend/overnight bags",170,Roque Bags,http://boticca.com/roquebags/tortoni-laptop-document-bags-camel/,Yes,"Fashion, Accessories, Luxury gifts",Boticcamens.jpg,Man,"Design lover, Traditionalist",+ £100
11/19/2012 14:47:10,Canary scarf,"This gorgeous silk and wool-blend scarf is from a new collection of scarves from Red Brick. The other prints are wonderful too
",60,Red Brick,http://www.redbricknorth.co.uk/Canary-Scarf,Yes,"Accessories, Luxury gifts",canaryscarf.jpg,Woman,Design lover,£50-100
11/19/2012 15:07:06,T-shirt,"A striking and oh-so-fashionable print from Capcom at the great steadyguy.co.uk, which is offering 10% off everything just for you, loyal Guardian reader. Enter the code guardian10 – it will run until 31 December 2012
",35,Capcom,http://www.steadyguy.co.uk/10Deep-Capcom-T-Shirt-White.html,Yes,Fashion,Capcomtee.jpg,"Man, Teenager",Design lover,£25-50
11/19/2012 15:14:22,Cashmere gloves,"Soft, snuggly cashmere gloves in a variety of lovely shades for men or women at a bargain price – you can't go wrong ",9.99,Gretna Green,http://www.gretnagreen.com/cashmere-gloves-b101,Yes,"Accessories, Luxury gifts",cashmeregloves.jpg,"Man, Woman, Teenager","Outdoorsy type, Traditionalist",Under £10
11/19/2012 15:18:59,Luxury knits,"Beautiful, classic styles made in the Scottish Borders from super-soft lambswool. The gorgeous circle scarf can be wrapped around or left to hang loose. There are also matching gloves and mittens, and a fetching bobble hat. Will last years",From 43,Hilary Grant,http://hilarygrant.co.uk/circle-scarf-arrow-infernolinen/,Yes,"Fashion, Accessories",charcoalscarf.jpg,Woman,"Outdoorsy type, Design lover, Traditionalist, Ethical",£50-100
11/19/2012 15:21:08,Cycling purse,"Screen-printed cotton canvas purse, featuring a very elegant lady cyclist, though we don't think that hat is entirely appropriate headwear",10,Chase and Wonder,http://shop.chaseandwonder.com/product/a-lady-rides-screen-printed-purse,Yes,Accessories,chaseandwonder.jpg,"Woman, Teenager","Outdoorsy type, Design lover, Traditionalist",Under £10
11/19/2012 15:28:07,Organic jeans,"These are not just any old jeans, these are jeans with a story. In short: Cardigan in Wales used to make 35,000 pairs a week, employing 400 people. Then the factory closed. The Hiut Denim Co decided to bring them back. Each pair also comes with a unique number. You go to the HistoryTag website and register, then follow their story. Lovely idea, beautifully made

 ",130,Hiut Denim Co,http://hiutdenim.co.uk/collections/all,Yes,"Fashion, Luxury gifts",hiut-denim.jpg,Man,"Outdoorsy type, Design lover, Traditionalist, Ethical",+ £100
11/19/2012 15:32:52,Clever socks,"Sorry, but it's a contractual obligation to include socks in every gift guide. These, though, are very clever socks. There's a thermal pair, a temperature-regulating pair and one to keep your toes cool. Socks that do everything bar wrap themselves up and put themselves under the tree
",25,Hotsquash,http://www.hotsquash.com/products/3socks?mc=1&sc=5,Yes,"Fashion, Accessories",hotsquash.jpg,Woman,Outdoorsy type,£10-25
11/19/2012 15:36:06,Outfit bundle,"Ideal if you want to buy something more than a piece of clothing but no idea what goes with what. Hush sells a variety of bundles of its laidback, elegant classic designs",85,Hush,http://www.hush-uk.com/loungewear/bundles/loungewear-set-9.html,Yes,"Fashion, Accessories",hushbundle.jpg,Woman,Traditionalist,£50-100
11/19/2012 15:38:48,Satchel,"A satchel that's far too cool for school, this geometric print style from Kate Sheridan is a great everyday size. Big enough for an iPad or large notebook, and can be carried from top handle or worn across the body
",85,Kate Sheridan,http://www.katesheridan.com/p373/Caramel-Triangle-Mini-satchel/product_info.html,Yes,"Fashion, Accessories, Luxury gifts",katesheridan.jpg,"Woman, Teenager",Design lover,£50-100
11/19/2012 15:41:42,Grey T-shirt,"A laidback wardrobe staple, made from hemp and cotton and manufactured under Fairtrade conditions 
",29.25,Komodo,http://www.ethicalsuperstore.com/products/komodo/komodo-charlie-tee/,Yes,Fashion,komodotop.jpg,"Man, Teenager",Ethical,£25-50
11/19/2012 15:45:25,Weather rucksack,"A bag collection based on the British obsession with the weather, the fabulous Laura Spring collection include duffels, pencil cases and capes. You could go for windy or warm designs, but we think wet is more British. All the products are hand-printed in the UK
",145,Laura Spring,http://www.lauraspring.bigcartel.com/product/wet-weather-rucksack,Yes,"Fashion, Accessories, Luxury gifts",lauraspring.jpg,"Man, Woman","Outdoorsy type, Ethical",+ £100
11/19/2012 15:54:35,Stylish scarf,Stunning photo-realistic print scarves from Rosso Forte made of modal – as soft as cashmere but with the distinct advantage of being washable. Stocked at Leggera Nell Aria (020-7352 7855),135,Rosso Forte,http://www.rossofortestudio.com/,Yes,"Fashion, Accessories, Luxury gifts",lilyscarf.jpg,Woman,"Design lover, Traditionalist",+ £100
11/19/2012 15:57:00,Knitted collar,A handmade crochet collar to add to a plain jumper is a more original take on buying jewellery and this one is particularly fetching,38,Lowie,http://www.ilovelowie.com/index.php?main_page=product_info&cPath=65_73&products_id=1169,Yes,"Fashion, Accessories",lowiecollar.jpg,"Woman, Teenager","Traditionalist, Ethical",£25-50
11/19/2012 15:59:41,Knitted scarf,Lightweight but very warm (it's made of alpaca wool) this stylish scarf is from one of Boticca's stable of talented independent designers,78,Hortensia,http://en-gb.boticca.com/hortensiahandmade/degrade-stripes-scarf-greys/,,"Fashion, Accessories, Luxury gifts",mansscarfboticca.jpg,Man,Outdoorsy type,£50-100
11/19/2012 16:01:48,Clutch bag,"Simple but oh-so-stylish, this clutch bag is fastened by the contrast strap, which wraps around.  Lined with cotton and with an interior pocket for coins, the bag is made in England from Italian vegetable-tan leather",150,M.Hulot,http://www.mhulot.co.uk/shop/bags/garrard-clutch-bag--graphiteblack#.UKpXj7vg3R4,Yes,"Fashion, Accessories, Luxury gifts",mhulotbag.jpg,Woman,"Design lover, Traditionalist",+ £100
11/19/2012 16:04:51,Classic bag,"This is Eric. To be honest, that was enough to catch our attention, but it (he?) also happens to be a timeless classic design that will last years and years and comes in a variety of colours. Produced in Manchester from Italian leather",160,Mimi Berry,http://www.mimiberry.co.uk/collection/ladies_bags/1040_mimi-eric,,"Fashion, Accessories",mimiberrybag.jpg,Woman,Traditionalist,+ £100
11/19/2012 16:10:46,Leather bag,"If you want true quality but dislike designer names (and markups) then look no further than these beautifully made, vegetable-tanned leather bags. Made in a 19th-century Welsh methodist chapel by leather worker Gaynor Howell, they come in a variety of colours with contrast handles that can be replaced",135,GDH Leatherwork,http://theshopfloorproject.com/Bags_GDH_LEATHERWORK.html,Yes,"Fashion, Accessories, Luxury gifts",shopfloorbag.jpg,Woman,"Design lover, Traditionalist",+ £100
11/19/2012 16:12:54,Travel bag,Great vibrant travel bag for frequent flyers – it has wheels and a retractable handle and is just the size for weekend breaks,75,Julie Slater & Son,https://www.julieslaterandson.co.uk/product/wheeled-cabin-bag-sandstripe/,Yes,Accessories,slaterTrolleyBag1.jpg,"Woman, Teenager",Outdoorsy type,£50-100
11/19/2012 16:15:45,Leather slippers,"A lovely simple pair of slippers made from reclaimed materials that would otherwise go to landfill. And £1 from each purchase is also donated to the homeless charity Emmaus, plus the slippers come in sizes for the entire family, from baby to bigfoot",30,Motties,http://www.motties.co.uk/shop/,Yes,"Kids clothes, Fashion, Accessories",slippers.jpg,"Man, Woman, Teenager, Child, Baby or toddler, Couples","Traditionalist, Ethical",£25-50
11/19/2012 16:18:49,Knitted tunic,"Sweaty Betty is the place to look for stylish workout wear, but it also has some lovely more fashion-led items, like this knitted tunic. Perfect for staying warm after the yoga class you meant to go to, but didn't",125,Sweaty Betty,http://www.sweatybetty.com/sanctuary-knitted-tunic-prodspa172_titaniumgrey/,Yes,"Fashion, Luxury gifts",sweatybetty.jpg,Woman,Outdoorsy type,+ £100
11/19/2012 16:20:37,Print pyjamas,"You can't get cosier than flannel PJs, and these ones come in a really lovely print",69,Toast,http://www.toast.co.uk/product/pjs+and+nighties/CHPP8/POPPY+PYJAMA.htm?categoryref=%2fcategory.aspx%3fcategoryid%3dpjs%2520and%2520nighties%26seoterm%3dpjs%2520nighties%26&pcat=pjs+and+nighties&adimage=&clr=CHPP8_ecrumulti,Yes,"Fashion, Luxury gifts",toastpjs.jpg,Woman,Traditionalist,£50-100
11/19/2012 16:24:04,Luxury satchel,"Tusting has been working with leather since 1875, so it stands to reason that it has got pretty darn good at it. The company produces some gorgeous, traditional bags for men and women. This satchel (a smaller size that will fit an A4 book) is particularly lovely",285,Tusting,http://www.tusting.co.uk/quinton-satchel-in-orange-weave-leather-with-dark-brown-bridle-trim-1.html,Yes,"Accessories, Luxury gifts",tustingbag.jpg,Woman,Traditionalist,+ £100
11/19/2012 16:28:17,Overnight bag,"Style without fuss, this great overnight bag comes with accessories too: a mesh toiletries bag, to make going through customs easier, plus a laptop sleeve and a pouch for cables. All of them attach to the inside and are interchangeable with other bags from the same company",80,Unit Portables,http://www.wantedwallets.com/bags-and-cases/unit-portables/unit-portables-unit-05-overnight-bag-w-laptop-sleeve-13-navy.html,Yes,"Fashion, Accessories",unitportables.jpg,Man,Design lover,£50-100
11/20/2012 8:18:26,Goose case,Honk! A cute little pencil case which would also double as a little makeup bag. Printed and wipe-clean,6.75,Boden,http://www.boden.co.uk/en-GB/Girls-8-16yrs-Accessories/98026/Girls-8-16yrs-Printed-Pencil-Case.html,Yes,"Stocking fillers, Stationery, Beauty",bodenbag.jpg,"Woman, Teenager, Child",Traditionalist,Under £10
11/20/2012 8:20:46,Perfect timing,What to get the teen who is never on time? A bit of pampering with a not-very-subtle hint attached: this bubble wash and body lotion kit comes with an alarm clock. For them to sleep through,18,Soap & Glory,http://www.boots.com/en/Soap-Glory-Bubble-Time_1273671/,Yes,Beauty,BubbleTime.jpg,"Woman, Teenager",,£10-25
11/20/2012 8:24:16,Wash bag,Great screen-printed washbag; perfect for men or women,20,Chase & Wonder,http://shop.chaseandwonder.com/product/ride-above-it-screen-printed-wash-bag,Yes,"Beauty, Accessories",chaseandwonderbikes.jpg,"Man, Woman, Teenager",Design lover,£10-25
11/20/2012 8:27:19,Nails it,Brilliantly packaged nail varnishes – each pill-shaped trio comes in a pharmaceutical style jar. Perfect prescription,15,Dose,http://www.cultbeauty.co.uk/dose-list,Yes,Beauty,dosegroupshot.jpg,"Woman, Teenager",Design lover,£10-25
11/20/2012 8:29:33,Washing up,Embroidered cotton wash bags in lovely bright prints made under fair-trade conditions,12.99,Ganesha,http://www.ganesha.co.uk/ShopPages/menu_accessories/bagcosmetic.php,Yes,"Beauty, Accessories",ganeshawashbag.jpg,"Woman, Teenager",Ethical,£10-25
11/20/2012 8:42:47,Super smellies,"You can't go wrong with Jo Malone scented candles or scents, and the pine and eucalyptus scent is particularly lovely and festive",From 22,Jo Malone,http://www.jomalone.co.uk/products/gift_finder/index.tmpl?cm_sp=Gnav-_-Gifts-_-GiftSets,Yes,"Homes/ decor, Beauty",jomalone.jpg,"Man, Woman",Traditionalist,£10-25
11/20/2012 8:47:54,Luxury scent,"All Miller Harris scents are unisex, but we think this luxurious Mediterranean-inspired scent is particularly good for men, with a sort of floral-patchouli mix that's bold and unusual
",62,Miller Harris,http://www.millerharris.com/fragrances-1/woody/terre-d-iris/terre-d-iris-eau-de-parfum-50ml.html,Yes,"Beauty, Luxury gifts",millerharris.jpg,"Man, Woman",Traditionalist,£50-100
11/20/2012 8:50:02,Have a hoot,An owl necklace that also doubles as a lip balm – you just open the secret compartment and help yourself. You can also buy refills on the site,34,Andrea Garland,http://www.andreagarland.co.uk/#/mr-hoots-necklace/4569335745,Yes,"Beauty, Jewellery",mrhoots.jpg,"Woman, Teenager",Traditionalist,£25-50
11/20/2012 8:54:13,Smelling of roses,"For someone who prefers their beauty as pure as possible, Ren has a wonderful range of rose-scented gifts. Top quality, beautifully packaged",32,Ren Clean Skincare,http://www.renskincare.com/p/3574/Moroccan+Rose+Experience+Gift+Set,Yes,Beauty,rengiftset.jpg,"Woman, Teenager",Ethical,£25-50
11/20/2012 8:57:49,Nailed to the tree,"Double up your decorations with your gifts: these sparkly nail varnishes, perfect for teens, come with little wings and a loop to hang from the tree",8.6,Showtime nails,http://www.feelunique.com/p/Mavala-Sparkling-Angel-Blue-and-Violet-Duo,Yes,"Stocking fillers, Decorations, Beauty",showtimenails.jpg,"Woman, Teenager",Traditionalist,Under £10
11/20/2012 9:00:35,Hero products,"Trilogy has been going for 10 years, and has got pretty good at this beauty lark. This set includes some wonderful natural products",29.5,Trilogy,http://www.lovelula.com/pd-trilogy-xmas-anniversary-collection.cfm,Yes,Beauty,trilogy.jpg,"Woman, Teenager",Traditionalist,£25-50
11/20/2012 9:04:01,Yes please nurse,"Yes! Nurse was founded by a young paediatric nurse as a natural treatment for busy, dry hands. It comes in a beautifully designed little box, and looks far more expensive than it is. It's also available as a subscription, so you can gift a tube a month to some hands in need
",5.49,Yes Nurse,http://www.yesnurse.co.uk/,Yes,"Stocking fillers, Beauty",YesNurse.jpg,"Man, Woman","Outdoorsy type, Traditionalist",Under £10
11/20/2012 11:00:12,Angelic mice,These sweet little mice can be hung up as decorations or just loved as toys,14,Maileg,http://www.cottontailsbaby.co.uk/product/maileg_angel_mouse_pink,Yes,"Toys, Decorations",cottontailsangelmice.jpg,"Child, Baby or toddler",Traditionalist,£10-25
11/20/2012 11:02:16,DIY decorations,"A small amount of fun, glue-and-scissors crafting will make up this gang of festive animals. Use as decorations, name places on the Christmas table or hang from the tree
",8.5,Mibo,http://www.mibo.co.uk/collections/frontpage/products/paper-animals-festive-friends,Yes,"Stocking fillers, Craft, Decorations",FestiveHR.jpg,"Teenager, Child, Baby or toddler",,Under £10
11/20/2012 11:04:19,Milk crate with roses,Fed up with poinsettias? Here's a charming and more lasting alternative; a lovely little retro milk crate which you can add seasonal flower to,From 9.50,The Fresh Flower Company,http://www.freshflower.co.uk/Shop/tabid/169/ProdID/18/Mini_milk_crate.aspx,Yes,"Homes/ decor, Gardens",Freshflowercrate.jpg,"Man, Woman, Couples",Traditionalist,Under £10
11/20/2012 11:11:59,Postcard nativity,Sweet little set of five postcards to cut out and make your own nativity scene,4.5,Poppy Treffry,http://www.poppytreffry.co.uk/christmas-nativity-postcard-set,Yes,"Stocking fillers, Toys, Decorations",poppytreffrycards.jpg,Child,Traditionalist,Under £10
11/20/2012 11:15:32,Garland art,"Either a beautiful bargain or a DIY decoration, this set of three limited-edition prints by the talented Alice Pattullo can be cut up and made into festive garlands. Or just framed and admired",12,Alice Pattullo,http://theshopfloorproject.com/CHRISTMAS_GARLANDS.html,Yes,"Homes/ decor, Decorations",Garlands.jpg,"Man, Woman, Couples",Design lover,£10-25
11/20/2012 11:19:00,Reindeer vase,A festive but also very tasteful reindeer from Georgina Fowler – who also makes great ceramic jewellery,28,Georgina Fowler,http://www.seekandadore.com/c/0/p/small-gold-reindeer-vessel/49.aspx,Yes,"Homes/ decor, Decorations",GeorginaFowler.jpg,"Man, Woman",Design lover,£25-50
11/20/2012 11:22:08,Paper angels,Use as place settings (just write the name in the middle) or decorations,9.95,Graham and Green,http://www.grahamandgreen.co.uk/set-of-7-angel-name-place-cards,Yes,"Homes/ decor, Decorations",grahamandgreenangels.jpg,"Teenager, Child, Baby or toddler, Couples",Traditionalist,Under £10
11/20/2012 11:25:00,Tasteful tree,"A stunning 6ft 8in Japanese-style inspired tree. If Christmas were always this tasteful, even Scrooge wouldn't object",100,John Lewis,http://www.johnlewis.com/231589340/Product.aspx,Yes,"Homes/ decor, Decorations, Luxury gifts",JLtree.jpg,"Man, Woman, Couples",Design lover,+ £100
11/20/2012 11:28:17,Sticky labels,Handy little sticky labels so you'll not get the presents confused – and won't have to Sellotape your fingers to the parcels while trying to attach the tags. Or is that just me? ,4.99,KTwo,https://www.ktwoproducts.com/products/195_christmas_sticky_labels,Yes,"Stationery, Decorations",ktwo.jpg,"Man, Woman, Teenager",,Under £10
11/20/2012 11:30:36,Christmas centrepiece,"A lovely first christmas gift or for a young child, this centrepiece will last years. Until you realise you're getting it out for yourself and the kids left home about a decade ago",19.99,Miffy,http://www.miffyshop.co.uk/miffy-wooden-christmas-tree.html,Yes,"Homes/ decor, Decorations",miffytree.jpg,"Child, Baby or toddler, Couples",Traditionalist,£10-25
11/20/2012 11:33:20,Paper wreath,"Very elegant and simple wreath made from recycled carboard laser-cut into leaves. Comes flatpacked – you just assemble yourself at home following simple instructions. You can decorate it, but we like it just the way it is",34,Whippet Grey,http://www.whippetgrey.co.uk/show_product.php?prod_id=668,Yes,"Homes/ decor, Decorations",paperwreath.jpg,"Man, Woman","Design lover, Traditionalist",£25-50
